question,user,category,detail1,detail2,detail3,detail4
통화연결음_매주자동변경에 가입하려면 통화연결음에 가입되어 있어야 하나요?,개인,모바일,부가서비스,뮤직,통화연결음_자동변경,
"KT, SKT 고객도 이용할 수 있나요?",개인,모바일,부가서비스,생활편의,U+카카오내비,
갑자기 원내비 앱이 삭제되었습니다. 다시 복구해 주세요.,개인,모바일,부가서비스,생활편의,U+카카오내비,
가입은 어떻게 하나요?,개인,모바일,부가서비스,뮤직,벨음세곡,
기존 빅플러스 GS칼텍스와 혜택은 동일한가요?,개인,혜택,신청/변경불가,제휴카드,,
약관은 홈페이지 어디에서 볼 수 있나요?,개인,서비스안내,홈페이지이용관련,,,
서비스 사용이 가능한 사이트는 어떻게 확인하나요?,개인,모바일,부가서비스,안심/안전,로그인플러스,
"날씨, 장소, 교통, 인물 정보는 어떤 기준으로 제공하나요?",개인,TV,상품안내,주요서비스,U+우리집 AI,
카드 브랜드 'ONE WAY'는 뭔가요?,개인,혜택,신청/변경불가,제휴카드,LG U+ 빅팟 PLUS 카드,
채팅+를 이용하려면 따로 가입신청을 해야 하나요?,개인,모바일,부가서비스,통화/메시지,채팅+,
약관은 홈페이지 어디에서 볼 수 있나요?,개인,서비스안내,홈페이지이용관련,,,
서비스 사용이 가능한 사이트는 어떻게 확인하나요?,개인,모바일,부가서비스,안심/안전,로그인플러스,
통화연결음쿠폰을 사용 중인데 통화연결음+매월1곡에 가입하면 이용권은 어떻게 되나요?,개인,모바일,부가서비스,뮤직,통화연결음쿠폰,
아이폰을 쓰는데 U+골프 앱을 이용할 수 있나요?,개인,5G,5G 부가서비스,U+골프,,
일반 스마트폰 충전 케이블을 전원으로 연결하여 사용해도 되나요?,개인,U+스마트홈,스마트홈 기기,수면센서,,
단말기 결제 형 카드로 이용하려고 하면 어떻게 해야 하나요?,개인,혜택,신청/변경불가,제휴카드,New LG U+ 우리카드,
생생 체험학습 서비스 이용시에 손 인식이 잘 되는 환경이 있나요?,개인,TV,상품안내,주요서비스,아이들나라,
POP서비스 약관에 동의하지 않았는데도 POP할인이 되었어요.,개인,모바일,부가서비스,생활편의,U+멤버스,
앱으로 할 수 있는 기능은 어떤 게 있나요?,개인,U+스마트홈,스마트홈 기기,블라인드 커튼,솜피 커튼 with U+스마트홈,
U+모바일tv에 회원 가입하면 어떤 점이 좋나요?,개인,모바일,부가서비스,영상,U+모바일tv,
"서비스를 이용하려면, 데이터를 사용해야 하나요?",개인,5G,5G 부가서비스,U+아이들생생도서관,,
'경기장줌인' 및 '홈밀착영상' 기능은 모든 경기 화면에서 이용할 수 있나요?,개인,5G,5G 부가서비스,U+프로야구,,
맘카 Easy가 촬영하고 있는 영상을 앱에서 아무나 볼 수 없게 비밀번호를 설정할 수 있나요?,개인,U+스마트홈,스마트홈 기기,맘카 Easy (Easy 전용),,
아이폰을 쓰는데 U+골프 앱을 이용할 수 있나요?,개인,5G,5G 부가서비스,U+골프,,
일반 스마트폰 충전 케이블을 전원으로 연결하여 사용해도 되나요?,개인,U+스마트홈,스마트홈 기기,수면센서,,
단말기 결제 형 카드로 이용하려고 하면 어떻게 해야 하나요?,개인,혜택,신청/변경불가,제휴카드,New LG U+ 우리카드,
생생 체험학습 서비스 이용시에 손 인식이 잘 되는 환경이 있나요?,개인,TV,상품안내,주요서비스,아이들나라,
삼성 에어컨 with U+스마트홈이 고장 나면 어디로 연락해야 하나요?,개인,U+스마트홈,스마트홈 기기,에어컨,삼성 에어컨 with U+스마트홈,
PASS 더치트 프리미엄은 무슨 서비스인가요?,개인,모바일,부가서비스,안심/안전,PASS 더치트 프리미엄,
스타와 함께 촬영한 사진이나 영상을 공유할 수 있나요?,개인,5G,5G 부가서비스,U+AR,,
장기 할부가 끝난 경우나 중도 상환한 경우는 어떻게 되나요?,개인,혜택,제휴카드로 할인,휴대폰 구매 할인,LG U+ 삼성카드2 V2,
노래 설정은 어떻게 하나요?,개인,모바일,부가서비스,뮤직,통화연결음,
U+ 보관함에 저장된 사진 화질이 좋지 않은 것 같아요.,개인,모바일,부가서비스,생활편의,U+ 보관함,
삼성패스는 모든 휴대폰에서 이용이 가능한가요?,개인,모바일,부가서비스,안심/안전,PASS,
원하지 않는 시간엔 맘카Easy가 촬영하지 않도록 설정할 수 있나요?,개인,U+스마트홈,스마트홈 기기,맘카 Easy (Easy 전용),,
"기존에 최초1회 무료로 주문제작을 한 다음 사용하고 있습니다. 상호명이 변경되어, 다시 제작하고 싶습니다. 어떻게 해야 하나요?",개인,모바일,부가서비스,뮤직,소호링,
어떤 세탁기와 연동할 수 있나요?,개인,U+스마트홈,스마트홈 기기,공기청정기,삼성 공기청정기 with U+스마트홈,
"기존에 최초1회 무료로 주문제작을 한 다음 사용하고 있습니다. 상호명이 변경되어, 다시 제작하고 싶습니다. 어떻게 해야 하나요?",개인,모바일,부가서비스,뮤직,소호링,
어떤 세탁기와 연동할 수 있나요?,개인,U+스마트홈,스마트홈 기기,공기청정기,삼성 공기청정기 with U+스마트홈,
웅진북클럽의 동화책 제목은 어디서 확인하나요?,개인,U+스마트홈 스피커,U+스마트홈 우리집AI,어린이,,
"광고를 봤는데, 적립금이 쌓이지 않거나 적게 쌓였어요.",개인,모바일,부가서비스,생활편의,U+멤버스,
통화연결음_청각장애인 서비스 해지는 어떻게 하나요?,개인,모바일,부가서비스,뮤직,통화연결음_청각장애인,
부모교실의 육아 종합검사 도중에 그만했다가 이어할 수 있나요?,개인,TV,상품안내,주요서비스,아이들나라,
인증서 이용내역은 어디에서 확인할 수 있나요?,개인,모바일,부가서비스,안심/안전,PASS 인증서,
기기를 해제하면 기존 수면점수 정보를 더 이상 볼 수 없나요?,개인,U+스마트홈,스마트홈 기기,수면센서,,
원키퍼 앱에 저장된 사진을 PC로 옮길 수 있나요?,개인,모바일,부가서비스,생활편의,원키퍼,기능
영화의 어떤 정보를 알 수 있나요?,개인,U+스마트홈 스피커,U+스마트홈 우리집AI,지식검색,,
부모교실의 육아 종합검사 도중에 그만했다가 이어할 수 있나요?,개인,TV,상품안내,주요서비스,아이들나라,
인증서 이용내역은 어디에서 확인할 수 있나요?,개인,모바일,부가서비스,안심/안전,PASS 인증서,
기기를 해제하면 기존 수면점수 정보를 더 이상 볼 수 없나요?,개인,U+스마트홈,스마트홈 기기,수면센서,,
원키퍼 앱에 저장된 사진을 PC로 옮길 수 있나요?,개인,모바일,부가서비스,생활편의,원키퍼,기능
영화의 어떤 정보를 알 수 있나요?,개인,U+스마트홈 스피커,U+스마트홈 우리집AI,지식검색,,
문자알림음을 다운로드 받는 도중에 끊겼습니다.,개인,모바일,부가서비스,뮤직,문자알림음,
삼성 공기청정기 with U+스마트홈이 고장 나면 어디로 연락해야 하나요?,개인,U+스마트홈,스마트홈 기기,공기청정기,삼성 공기청정기 with U+스마트홈,
만약 1만원 미만으로 통신료가 나온다면 할인되고 남은 금액은 별도로 지급해주나요?,개인,혜택,신청/변경불가,제휴카드,LG U+ 할인포커스 KB 국민카드,
가족카드 기준은 무엇인가요?,개인,혜택,신청/변경불가,제휴카드,현대카드M Edition2(라이트할부형),
U+스마트홈 앱에서 쿠첸 밥솥을 실행할 수 있나요?,개인,U+스마트홈,스마트홈 기기,밥솥,쿠첸 밥솥 with U+스마트홈,
제가 찾는 곡이 없어요. 통화연결음 신청곡 추가는 어떻게 하죠?,개인,모바일,부가서비스,뮤직,통화연결음,
어떤 단말에서 사용 가능한가요?,개인,5G,5G 부가서비스,U+초등나라,,
피싱 의심번호 알림을 끌 수도 있나요?,개인,모바일,부가서비스,안심/안전,스마트피싱보호,
삼성 공기청정기 with U+스마트홈이 고장 나면 어디로 연락해야 하나요?,개인,U+스마트홈,스마트홈 기기,공기청정기,삼성 공기청정기 with U+스마트홈,
만약 1만원 미만으로 통신료가 나온다면 할인되고 남은 금액은 별도로 지급해주나요?,개인,혜택,신청/변경불가,제휴카드,LG U+ 할인포커스 KB 국민카드,
가족카드 기준은 무엇인가요?,개인,혜택,신청/변경불가,제휴카드,현대카드M Edition2(라이트할부형),
U+스마트홈 앱에서 쿠첸 밥솥을 실행할 수 있나요?,개인,U+스마트홈,스마트홈 기기,밥솥,쿠첸 밥솥 with U+스마트홈,
보호자 2명을 지정할 수 있나요?,개인,모바일,부가서비스,안심/안전,휴대폰결제 안심 알림,
고객 혜택 제공에 대한 유예기간이 있나요?,개인,혜택,신청/변경불가,제휴카드,LG U+ 1Q카드 Living,
"U+카카오내비로 업데이트하면 원내비에 등록한 ‘즐겨찾기’, ‘최근목적지’ 정보도 그대로 이용할 수 있다고 했는데, 연동되어 있지 않아요",개인,모바일,부가서비스,생활편의,U+카카오내비,
인증한 내용을 잊어버렸어요. 어디서 확인하나요?,개인,모바일,부가서비스,안심/안전,PASS 인증서,
고객 혜택 제공에 대한 유예기간이 있나요?,개인,혜택,신청/변경불가,제휴카드,LG U+ 1Q카드 Living,
"U+카카오내비로 업데이트하면 원내비에 등록한 ‘즐겨찾기’, ‘최근목적지’ 정보도 그대로 이용할 수 있다고 했는데, 연동되어 있지 않아요",개인,모바일,부가서비스,생활편의,U+카카오내비,
차량 상시전원 연결과 시거잭 연결 시 서비스 이용에 차이가 있나요?,개인,모바일,부가서비스,신규/변경불가 부가서비스,U+ LTE블랙박스,
모든 휴대폰에서 이용할 수 있나요?,개인,5G,5G 부가서비스,스마트홈트,,
기기등록 시 등록할 와이파이가 보이지 않아요.,개인,U+스마트홈,스마트홈 기기,간식로봇,,
무료 서비스를 해지하면 어떻게 되나요?,개인,모바일,부가서비스,안심/안전,PASS 휴대폰번호 로그인,
영어유치원은 레벨테스트 문항을 풀 때 시간 제한이 있나요?,개인,TV,상품안내,주요서비스,아이들나라,
유플러스 고객이라면 누구나 혜택을 받을 수 있나요?,개인,혜택,제휴 우대 혜택,전북은행 금융우대혜택,,
통화연결음쿠폰을 가지고 있는데 인사말 통화연결음에 가입 못하나요?,개인,모바일,부가서비스,뮤직,인사말 통화연결음,
영어유치원은 레벨테스트 문항을 풀 때 시간 제한이 있나요?,개인,TV,상품안내,주요서비스,아이들나라,
유플러스 고객이라면 누구나 혜택을 받을 수 있나요?,개인,혜택,제휴 우대 혜택,전북은행 금융우대혜택,,
통화연결음쿠폰을 가지고 있는데 인사말 통화연결음에 가입 못하나요?,개인,모바일,부가서비스,뮤직,인사말 통화연결음,
MP3를 다운 받았는데 못 찾겠어요. 어디에 저장되나요?,개인,모바일,부가서비스,데이터,알짜정액존,
영상 콘텐츠(VOD) 시청 중 재생 오류가 발생하면서 화면이 닫혀요.,개인,5G,5G 부가서비스,U+골프,,
다운로드 받은 VR 영상은 어디서 확인할 수 있나요?,개인,5G,5G 부가서비스,U+아이돌Live,,
생생 체험학습은 어떤 콘텐츠로 구성되어 있나요?,개인,TV,상품안내,주요서비스,아이들나라,
"U+tv를 이용하고 있는데, U+아이돌Live를 찾을 수 없어요. 어떻게 설치해야 하나요?",개인,TV,상품안내,주요서비스,아이돌Live,
선불요금제 고객인데 통화연결음을 어떻게 가입하나요?,개인,모바일,부가서비스,뮤직,통화연결음,
생생 체험학습 서비스 이용시에 손 인식이 잘 되고 있는지 알 수 있나요?,개인,TV,상품안내,주요서비스,아이들나라,
생생 체험학습은 어떤 콘텐츠로 구성되어 있나요?,개인,TV,상품안내,주요서비스,아이들나라,
"U+tv를 이용하고 있는데, U+아이돌Live를 찾을 수 없어요. 어떻게 설치해야 하나요?",개인,TV,상품안내,주요서비스,아이돌Live,
선불요금제 고객인데 통화연결음을 어떻게 가입하나요?,개인,모바일,부가서비스,뮤직,통화연결음,
생생 체험학습 서비스 이용시에 손 인식이 잘 되고 있는지 알 수 있나요?,개인,TV,상품안내,주요서비스,아이들나라,
스마트 공동인증 서비스 이용 중 전화가 오면 어떻게 되나요?,개인,모바일,부가서비스,안심/안전,스마트공동인증(드림시큐리티),
U+tv와 U+아이들나라 모바일 앱은 어떻게 연결하나요?,개인,TV,상품안내,주요서비스,아이들나라,
부모교실의 육아 종합검사를 다시 하게 되면 기존 검사 결과는 삭제되나요?,개인,TV,상품안내,주요서비스,아이들나라,
프로그램에 언제든지 가입할 수 있나요?,개인,혜택,휴대폰 살때 할인,중고폰 가격보장 프로그램_Note9_24개월,,
휴대폰으로 U+아이돌Live를 보는 것과 다른 점은 무엇인가요?,개인,TV,상품안내,주요서비스,아이돌Live,
워치에서 이용할 수 있나요?,개인,모바일,부가서비스,생활편의,U+카카오내비,
준쉐이드 블라인드에 대해 궁금한 점은 어디에 문의하나요?,개인,U+스마트홈,스마트홈 기기,블라인드 커튼,준쉐이드 블라인드 with U+스마트홈,
서비스 이용 중 기기 변경을 한 경우에도 계속 이용할 수 있나요?,개인,모바일,부가서비스,안심/안전,PASS 휴대폰번호 로그인,
U+tv와 U+아이들나라 모바일 앱은 어떻게 연결하나요?,개인,TV,상품안내,주요서비스,아이들나라,
부모교실의 육아 종합검사를 다시 하게 되면 기존 검사 결과는 삭제되나요?,개인,TV,상품안내,주요서비스,아이들나라,
프로그램에 언제든지 가입할 수 있나요?,개인,혜택,휴대폰 살때 할인,중고폰 가격보장 프로그램_Note9_24개월,,
휴대폰으로 U+아이돌Live를 보는 것과 다른 점은 무엇인가요?,개인,TV,상품안내,주요서비스,아이돌Live,
워치에서 이용할 수 있나요?,개인,모바일,부가서비스,생활편의,U+카카오내비,
아이폰 사용자에게 MP3를 선물하고 싶어요.,개인,모바일,부가서비스,신규/변경불가 부가서비스,무제한음악감상+MP3 다운로드,
서비스 가입은 어떻게 하나요?,개인,모바일,부가서비스,안심/안전,PASS 금융사기방지,
온도조절기는 어디에서 구매할 수 있나요?,개인,U+스마트홈,스마트홈 기기,온도조절기,린나이 온도조절기 with U+스마트홈,
"SKT, KT 고객도 이용할 수 있나요?",개인,모바일,부가서비스,영상,U+아이돌Live,
U+초등나라 서비스에 어떻게 로그인해야 하나요?,개인,5G,5G 부가서비스,U+초등나라,,
수면센서가 제대로 작동하는지 어떻게 알 수 있나요?,개인,U+스마트홈,스마트홈 기기,수면센서,,
휴대폰 로그인은 꼭 해야 하나요?,개인,5G,5G 부가서비스,U+아이돌Live,,
서비스 가입은 어떻게 하나요?,개인,모바일,부가서비스,안심/안전,PASS 금융사기방지,
온도조절기는 어디에서 구매할 수 있나요?,개인,U+스마트홈,스마트홈 기기,온도조절기,린나이 온도조절기 with U+스마트홈,
U+스마트홈 앱에서 삼성 세탁기 with U+스마트홈을 실행할 수 있나요?,개인,U+스마트홈,스마트홈 기기,세탁기,삼성 세탁기 with U+스마트홈,
인증 요청 알림이 왔는데 취소 버튼을 눌렀어요. 다시 인증할 수 없나요?,개인,모바일,부가서비스,안심/안전,PASS 인증서,
지포스나우 베이직과 프리미엄은 어떻게 다른가요?,개인,5G,5G 부가서비스,GeForce NOW,,
U+스마트홈 앱에 여러 대의 대진DMP 조명 with U+스마트홈을 등록할 수 있나요?,개인,U+스마트홈,스마트홈 기기,조명,,
서비스 On/Off 여부는 어떻게 확인 하나요?,개인,모바일,부가서비스,생활편의,번호안내 서비스,
인증 요청 알림이 왔는데 취소 버튼을 눌렀어요. 다시 인증할 수 없나요?,개인,모바일,부가서비스,안심/안전,PASS 인증서,
지포스나우 베이직과 프리미엄은 어떻게 다른가요?,개인,5G,5G 부가서비스,GeForce NOW,,
U+스마트홈 앱에 여러 대의 대진DMP 조명 with U+스마트홈을 등록할 수 있나요?,개인,U+스마트홈,스마트홈 기기,조명,,
다른 통신사 고객도 U+초등나라 서비스에 가입할 수 있나요?,개인,5G,5G 부가서비스,U+초등나라,,
모든 기능을 무료로 이용할 수 있나요?,개인,모바일,부가서비스,영상,U+아이돌Live,
YBM 영어서비스를 이용하려면 YBM 영어 앱을 설치해야 하나요?,개인,U+스마트홈 스피커,U+스마트홈 우리집AI,외국어,,
채팅+는 별도의 앱을 설치해야 하나요?,개인,모바일,부가서비스,통화/메시지,채팅+,
휴대폰 화면을 노트북 또는 PC로 보려면 어떻게 해야 하나요?,개인,5G,5G 부가서비스,스마트홈트,,
책 읽어주는TV 나만의 책방의 책 추천 원리가 궁금합니다.,개인,TV,상품안내,주요서비스,아이들나라,
커튼의 실제 상태가 앱 화면과 일치 하지 않아요. 왜 그런가요?,개인,U+스마트홈,스마트홈 기기,블라인드 커튼,솜피 커튼 with U+스마트홈,
모든 기능을 무료로 이용할 수 있나요?,개인,모바일,부가서비스,영상,U+아이돌Live,
YBM 영어서비스를 이용하려면 YBM 영어 앱을 설치해야 하나요?,개인,U+스마트홈 스피커,U+스마트홈 우리집AI,외국어,,
채팅+는 별도의 앱을 설치해야 하나요?,개인,모바일,부가서비스,통화/메시지,채팅+,
휴대폰 화면을 노트북 또는 PC로 보려면 어떻게 해야 하나요?,개인,5G,5G 부가서비스,스마트홈트,,
책 읽어주는TV 나만의 책방의 책 추천 원리가 궁금합니다.,개인,TV,상품안내,주요서비스,아이들나라,
대진DMP 조명 with U+스마트홈에서 주등과 무드등을 동시에 켤 수 있나요?,개인,U+스마트홈,스마트홈 기기,조명,,
U+스마트홈 Easy 앱은 어떻게 로그인하나요?,개인,U+스마트홈,U+스마트홈 서비스,U+스마트홈 Easy 앱,,
'VR 영상' 기능은 무엇인가요?,개인,5G,5G 부가서비스,U+아이돌Live,,
'아프리카TV' 영상은 어디서 볼 수 있나요?,개인,모바일,부가서비스,영상,U+모바일tv,
'VR 영상' 기능은 무엇인가요?,개인,5G,5G 부가서비스,U+아이돌Live,,
'아프리카TV' 영상은 어디서 볼 수 있나요?,개인,모바일,부가서비스,영상,U+모바일tv,
전자서명 중 전화가 오면 어떻게 되나요?,개인,모바일,부가서비스,안심/안전,USIM 스마트인증(라온시큐어),
"TV에서 키즈월정액 가입해서 보고 있는데, 모바일에서 똑같은 콘텐츠를 보려고 하면 또 가입하라고 뜨는데 왜 그런 건가요?",개인,TV,상품안내,주요서비스,아이들나라,
맘카 Easy를 분실했습니다. 어떻게 하나요?,개인,U+스마트홈,스마트홈 기기,맘카 Easy (Easy 전용),,
어떤 오디오 콘텐츠를 들을 수 있나요?,개인,TV,상품안내,주요서비스,AI 오디오,
U+스마트홈 앱에 등록한 가전제품은 어떻게 삭제하나요?,개인,U+스마트홈,스마트홈 기기,오븐,삼성 오븐 with U+스마트홈,
"서비스 이용 시, 데이터가 사용되나요?",개인,5G,5G 부가서비스,U+초등나라,,
스피커가 알려주는 운세 정보는 어떤 기준으로 알려주나요?,개인,U+스마트홈 스피커,U+스마트홈 우리집AI,지식검색,,
어떤 보일러에서 온도조절기 사용이 가능한가요?,개인,U+스마트홈,스마트홈 기기,온도조절기,린나이 온도조절기 with U+스마트홈,
맘카 Easy를 분실했습니다. 어떻게 하나요?,개인,U+스마트홈,스마트홈 기기,맘카 Easy (Easy 전용),,
어떤 오디오 콘텐츠를 들을 수 있나요?,개인,TV,상품안내,주요서비스,AI 오디오,
U+스마트홈 앱에 등록한 가전제품은 어떻게 삭제하나요?,개인,U+스마트홈,스마트홈 기기,오븐,삼성 오븐 with U+스마트홈,
"서비스 이용 시, 데이터가 사용되나요?",개인,5G,5G 부가서비스,U+초등나라,,
스피커가 알려주는 운세 정보는 어떤 기준으로 알려주나요?,개인,U+스마트홈 스피커,U+스마트홈 우리집AI,지식검색,,
어떤 보일러에서 온도조절기 사용이 가능한가요?,개인,U+스마트홈,스마트홈 기기,온도조절기,린나이 온도조절기 with U+스마트홈,
휴대폰을 잃어버렸는데 연산암호도 기억나지 않습니다.,개인,모바일,부가서비스,안심/안전,로그인플러스,
내가 본 영상 중 일부를 목록에서 삭제할 수 있나요?,개인,모바일,부가서비스,영상,U+모바일tv,
미성년자도 이용할 수 있나요?,개인,모바일,부가서비스,안심/안전,스마트피싱보호,
도레미 물감놀이에서 팔레트를 두 손으로 만질 수 있나요?,개인,TV,상품안내,주요서비스,아이들나라,
기기등록 시 등록할 와이파이가 보이지 않아요.,개인,U+스마트홈,스마트홈 기기,원격급식기,,
무료서비스를 해지하면 어떻게 되나요?,개인,모바일,부가서비스,생활편의,PASS펀드,
U+골프 앱의 모든 콘텐츠는 무료인가요?,개인,5G,5G 부가서비스,U+골프,,
내가 본 영상 중 일부를 목록에서 삭제할 수 있나요?,개인,모바일,부가서비스,영상,U+모바일tv,
미성년자도 이용할 수 있나요?,개인,모바일,부가서비스,안심/안전,스마트피싱보호,
도레미 물감놀이에서 팔레트를 두 손으로 만질 수 있나요?,개인,TV,상품안내,주요서비스,아이들나라,
런칭 시점부터는 기존 ARS는 어떻게 운영되나요?,개인,혜택,신청/변경불가,제휴카드,SMART9 신한 빅플러스 카드,
삼성 오븐 with U+스마트홈이 고장 나면 어디로 연락해야 하나요?,개인,U+스마트홈,스마트홈 기기,오븐,삼성 오븐 with U+스마트홈,
기기를 변경해도 서비스를 그대로 이용할 수 있나요?,개인,모바일,부가서비스,안심/안전,PASS 모바일운전면허 확인 서비스,
차량사고에 대해 연락받을 사람을 추가로 지정할 수가 있나요?,개인,모바일,부가서비스,신규/변경불가 부가서비스,U+ LTE블랙박스,
U+스마트홈과 서비스 연결할 수 있는 LG 로봇청소기 with U+스마트홈은 어떤 모델인가요?,개인,U+스마트홈,스마트홈 기기,로봇청소기,LG 로봇청소기 with U+스마트홈,
"원내비 앱 업데이트 후 U+카카오내비가 설치되고, 원내비가 삭제되었습니다. 다시 복구해 주세요.",개인,모바일,부가서비스,생활편의,U+카카오내비,
스피커가 알려주는 영화평점은 어떤 기준으로 알려주나요?,개인,U+스마트홈 스피커,U+스마트홈 우리집AI,지식검색,,
삼성 오븐 with U+스마트홈이 고장 나면 어디로 연락해야 하나요?,개인,U+스마트홈,스마트홈 기기,오븐,삼성 오븐 with U+스마트홈,
기기를 변경해도 서비스를 그대로 이용할 수 있나요?,개인,모바일,부가서비스,안심/안전,PASS 모바일운전면허 확인 서비스,
차량사고에 대해 연락받을 사람을 추가로 지정할 수가 있나요?,개인,모바일,부가서비스,신규/변경불가 부가서비스,U+ LTE블랙박스,
LG생활건강샵 쇼핑 서비스는 어떻게 이용해야 하나요?,개인,U+스마트홈 스피커,U+스마트홈 우리집AI,쇼핑,,
법인폰에서도 이용할 수 있나요?,개인,모바일,부가서비스,안심/안전,PASS 모바일운전면허 확인 서비스,
웅진북클럽TV 책은 추천이 안 되는데 어떻게 추천 받을 수 있어요?,개인,TV,상품안내,주요서비스,아이들나라,
서비스 이용요금은 얼마인가요?,개인,모바일,부가서비스,안심/안전,PASS 휴대폰번호 로그인,
외국어 번역 서비스도 TV 화면으로 답변을 볼 수 있나요?,개인,U+스마트홈 스피커,U+스마트홈 우리집AI,외국어,,
PASS 앱을 삭제하면 어떻게 되나요?,개인,모바일,부가서비스,안심/안전,PASS 더치트 프리미엄,
모든 휴대폰에서 이용할 수 있나요?,개인,모바일,부가서비스,안심/안전,PASS 인증서,
외국어놀이 번역 결과가 이상해요.,개인,TV,상품안내,주요서비스,아이들나라,
내가 쓰던 수면센서 기기를 다른 가족이 사용할 수 있나요?,개인,U+스마트홈,스마트홈 기기,수면센서,,
모든 기능을 무료로 이용할 수 있나요?,개인,5G,5G 부가서비스,U+아이돌Live,,
안심지역을 설정하면 어떤 점이 좋나요?,개인,모바일,부가서비스,안심/안전,U+가족지킴이,
