question,user,category,detail1,detail2,detail3,detail4
갑자기 인터넷 연결이 되지 않습니다.,개인,인터넷,장애/고장,,,
U+인터넷/전화/IPTV 부가서비스를 변경 또는 해지하려면 어떻게 해야 하나요?,개인,가입 및 변경,인터넷,,,
사용하던 U+ 휴대폰(모바일)을 일지정지 하려고 합니다. 어떻게 해야 하나요?,개인,가입 및 변경,모바일,,,
휴대폰 해지 시 가입비를 돌려 받을 수 있나요?,개인,가입 및 변경,모바일,,,
핸드폰을 분실했는데 일시정지를 어떻게 하나요?,개인,가입 및 변경,모바일,,,
요금이 미납된 경우에는 어떻게 납부해야 하나요?,개인,요금 및 납부,요금납부,,,
"셋톱박스의 전원은 켜져있는데, TV 화면이 나오지 않습니다.",개인,TV,장애/고장,,,
할인옵션은 무엇이 있나요?,개인,혜택,기타 할인 혜택,,,
"신용카드 자동이체는 어떻게 신청하고, 어떤 혜택이 있습니까?",개인,혜택,기타 할인 혜택,,,
"데이터 무제한 서비스가 있는데, U+zone 이용할 필요가 있나요?",개인,인터넷,U+zone,상품안내,,
"TV화면이 제대로 나오지 않아요 (화면 모자이크 / 화면 깨짐 및 멈춤 현상 / TV화면에 ""채널신호 수신 중"" 문구가 뜨는 경우)",개인,TV,장애/고장,,,
이사 때문에 인터넷을 다시 설치해야 하는데 방법을 알려주세요.,개인,가입 및 변경,설치장소 변경,,,
휴대폰 번호변경을 하고싶습니다. 직접 신청할 수 있나요?,개인,서비스안내,홈페이지이용관련,,,
U+zone은 어떻게 이용하나요?,개인,인터넷,U+zone,가입신청,,
리모컨의 모든 버튼이 작동되지 않습니다.,개인,TV,장애/고장,,,
멤버십 VVIP+/VIP+/VVIP/VIP 등급인데요. 나만의 콕 영화예매는 어떻게 하나요?,개인,혜택,멤버십 혜택,멤버십제휴사,,
멤버십 카드 서비스에 대해서 알고 싶습니다.,개인,혜택,멤버십 혜택,멤버십카드 / 앱,,
U+zone은 무엇인가요?,개인,인터넷,U+zone,상품안내,,
청구서는 언제 도착하나요?,개인,요금 및 납부,요금조회,,,
월별 청구요금을 확인하고 싶습니다.,개인,요금 및 납부,요금조회,,,
요금제를 월 중간에 변경할 경우 요금과 부가서비스는 어떻게 적용되는 건가요?,개인,요금 및 납부,요금조회,,,
청구요금의 상세 내역이 궁금해요.,개인,요금 및 납부,요금조회,,,
C-14026(또는 S-69001) 오류코드가 뜹니다. 무엇인가요?,개인,TV,장애/고장,,,
미납으로 서비스가 중지되었습니다. 요금을 납부하면 바로 서비스를 이용할수 있나요?,개인,요금 및 납부,요금납부,,,
U+zone에 어떻게 가입하나요?,개인,인터넷,U+zone,가입신청,,
요금을 납부할 수 있는 방법으로는 어떤 종류가 있나요?,개인,요금 및 납부,요금납부,,,
U+인터넷전화에서 와이파이 연결방법이 궁금합니다.,개인,전화,인터넷전화,장애/고장,,
E-mail 청구서가 오지 않은데 어떻게 해야 하나요?,개인,요금 및 납부,요금조회,,,
U+ 인터넷전화 번호변경 시 요금이 부과되나요?,개인,가입 및 변경,인터넷전화,,,
약정할인을 중도에 해지할 경우 할인반환금이 부과되나요?,개인,혜택,요금할인,,,
인터넷 약정이 끝나면 요금은 어떻게 되나요?,개인,인터넷,요금안내,,,
전화차단 시 상대방에게는 어떤 멘트가 나가나요?,개인,모바일,부가서비스,통화/메시지,지정번호필터링,
속도 측정방법을 알려주세요.,개인,인터넷,장애/고장,,,
ez포인트(이지포인트) 사용 방법이 궁금해요.,개인,혜택,멤버십 혜택,멤버십카드 / 앱,,
"U+인터넷, U+인터넷전화 상품을 약정기간 내에 해지시 위약금이 발생되나요?",개인,가입 및 변경,인터넷,,,
U+와이파이100은 무엇인가요?,개인,인터넷,장비안내,와이파이,,
"홈페이지에서 해지상담 신청절차는 어떻게 되며, 처리까지 얼마나 걸리나요?",개인,가입 및 변경,인터넷,,,
단통법이란 무엇인가요?,개인,혜택,휴대폰 살때 할인,단통법,,
요금이 이중 납부되었습니다. 환불은 어떻게 받나요?,개인,요금 및 납부,요금납부,,,
U+스마트홈 앱에서 AI리모컨 상태가 연결 끊김으로 보여요. 어떻게 해야 하나요?,개인,U+스마트홈,스마트홈 기기,AI리모컨,,
벨소리는 어떻게 다운받나요?,개인,모바일,부가서비스,뮤직,벨소리,
"U+스팸차단 앱에서 스팸이 차단되었다고 문자메시지가 왔는데, 차단된 문자메시지를 확인하려면 어떻게 해야 하나요?",개인,모바일,부가서비스,통화/메시지,스팸차단,
기가와이파이와 맘카 앱을 어떻게 연결해야 하나요?,개인,U+스마트홈,스마트홈 기기,맘카,,
핸드폰 할부금을 일시불로 납부하고 싶습니다.,개인,모바일,요금제,,,
낮인데 맘카 모니터링 화면이 흑백으로 나와요. 고장인가요?,개인,U+스마트홈,스마트홈 기기,맘카,,
신용카드로 요금을 납부할 수 있는 방법은?,개인,요금 및 납부,요금납부,,,
데이터를 마음껏 주고 받을 수 있는 건가요?,개인,모바일,요금제,데이터혜택,,
U+ ID 회원가입은 어떻게 하나요?,개인,서비스안내,,,,
납부방법 별 요금 결제일을 알고 싶습니다.,개인,요금 및 납부,요금납부,,,
데이터쉐어링은 모든 LTE 단말에서 등록이 가능한가요?,개인,모바일,부가서비스,데이터,데이터 안심옵션,
데이터가 다 소진되었는데요. 요금제 충전은 어디서할 수 있나요?,개인,모바일,부가서비스,신규/변경불가 부가서비스,U+ LTE블랙박스,
와이파이란 무엇인가요?,개인,인터넷,장비안내,와이파이,,
이사 때문에 인터넷과 IPTV를 다시 설치해야 하는데 설치비는 얼마인가요?,개인,가입 및 변경,설치장소 변경,,,
ID랑 비밀번호를 발급받았는데 접속이 되지 않아요! 어떻게 해야 하죠?,개인,인터넷,U+zone,이용안내,,
홈페이지에서 번호변경하는 방법을 알려주세요.,개인,서비스안내,홈페이지이용관련,,,
현금 영수증을 발급 받으려면 어떻게 해야 하나요?,개인,요금 및 납부,요금조회,,,
리모컨이 분실되었는데 어떻게 하죠?,개인,TV,장애/고장,,,
군입대로 U+휴대폰 정지를 하고 싶은데 어떻게 해야하나요?,개인,가입 및 변경,군입대 일시정지,,,
스마트 주말할인에서 공휴일로 요금 할인을 받을 수 있는 건 어떤 날입니까?,개인,혜택,기타 할인 혜택,,,
은행 자동이체 출금일 변경이 가능한가요?,개인,요금 및 납부,요금납부,,,
인터넷이 가끔 끊어지는데 왜 그런가요?,개인,인터넷,장애/고장,,,
홈페이지에서 선택약정할인 가입을 할 수 있나요?,개인,혜택,요금할인,선택약정할인,,
어떻게 이용할 수 있나요?,개인,모바일,요금제,데이터혜택,,
부가세란 무엇인가요?,개인,요금 및 납부,요금납부,,,
베이직플랜과 식스플랜에 대해 알려주세요.,개인,혜택,휴대폰 살때 할인,단통법,,
인터넷 약정기간이 끝나가는데 재약정은 어디서 하나요?,개인,가입 및 변경,인터넷,,,
해지했는데 요금청구서가 나왔어요. 왜 그런가요?,개인,요금 및 납부,요금조회,,,
지원금을 많이 받기 위해 고가의 요금제로 개통하였습니다. 추후 저가 요금제로 변경할 수 있나요?,개인,혜택,휴대폰 살때 할인,단통법,,
데이터 통화료는 유료인가요?,개인,모바일,부가서비스,안심/안전,널 지켜줄게,
고객센터 앱으로 일시정지/해제를 할 수 있나요?,개인,서비스안내,고객센터 앱,,,
요금을 납부하였으나 미납으로 보이는데 왜 그런가요?,개인,요금 및 납부,요금조회,,,
U+인터넷을 이전하려는 주소지가 설치불가능 지역일때는 어떻게 하나요?,개인,가입 및 변경,설치장소 변경,,,
"지인에게 '대통령 공약으로 휴대폰 요금 25 % 할인'을 해준다는 문자가 왔는데, 정말 받을 수 있는건가요?",개인,혜택,요금할인,선택약정할인,,
데이터를 다 소진하지 못하고 유효기간이 만료되면 남은 데이터에 대해서 소급되나요?,개인,모바일,부가서비스,신규/변경불가 부가서비스,U+ LTE블랙박스,
"인터넷은 잘 되는데 TV화면이 검은색으로 신호없음, 자동채널검색 이라고 나와요.",개인,TV,장애/고장,,,
FREE_U+zone에 접속해서 웹브라우저를 실행했는데 이미지나 글자가 아무것도 나오지 않아요. 어떻게 해야 하죠?,개인,인터넷,U+zone,상품안내,,
선택약정할인의 약정기간이 있나요?,개인,혜택,휴대폰 살때 할인,단통법,,
납부계좌를 다른 사람 명의의 계좌로 변경할 수 있나요?,개인,요금 및 납부,요금납부,,,
인터넷전화 해지할 경우 단말기 대금 및 단말기 처리는 어떻게 해야하나요?,개인,가입 및 변경,인터넷전화,,,
미납금은 어떻게 납부하나요?,개인,요금 및 납부,요금납부,,,
분실한 폰을 찾았습니다. 다시 사용하고 싶은데 어떻게 해야 하나요?,개인,모바일,단말기(휴대폰),휴대폰분실파손,,
"상대방이 ""발신자번호강제표시"" 이용 중일때 ""발신번호표시제한"" 으로 전화를 걸면 어떻게 되나요?",개인,모바일,부가서비스,통화/메시지,발신자미표시번호차단,
LTE 요금제의 기본 데이터 제공량을 초과한 후 추가 과금은 어떻게 되나요?,개인,모바일,요금제,기타,,
해지시 별도의 위약금이 있나요?,개인,혜택,신청/변경불가,(구) 가족 무한사랑 클럽,,
와이파이 장비에 전원이 들어 오지 않습니다.,개인,인터넷,장애/고장,,,
휴대폰을 분실했는데 어떻게 해야 하나요?,개인,모바일,단말기(휴대폰),휴대폰분실파손,,
국제전화 사용 시 요금 부과는 어떻게 되나요?,개인,요금 및 납부,요금조회,,,
집에 누가 들어온 적이 없는데 휴대폰으로 알림이 왔습니다.,개인,U+스마트홈,스마트홈 기기,맘카,,
연체료 부과기준은 어떻게 되나요?,개인,요금 및 납부,요금조회,,,
가입하면 돈 드는거 아니에요?,개인,인터넷,U+zone,가입신청,,
019-114로 발송되는 문자차단이 가능한가요?,개인,모바일,부가서비스,통화/메시지,스팸차단,
U+ 휴대폰 잔여 할부금 중 일부만 납부할 수 있나요?,개인,요금 및 납부,요금납부,,,
영화관람 혜택은 LTE음성/데이터 80 요금제 이상 고객만 받을 수 있는 건가요?,개인,혜택,신청/변경불가,U클럽,,
차단번호는 어떻게 설정하나요?,개인,모바일,부가서비스,통화/메시지,지정번호필터링,
사용하던 U+인터넷 서비스를 일시정지하려고 하는데 어떻게 해야 하나요?,개인,가입 및 변경,인터넷,,,
KT나 SKT의 와이파이존에 비교해서 장점이 뭐죠?,개인,인터넷,U+zone,상품안내,,
"""인터넷 연결이 올바르지 않습니다"" 라고 나오며 TV 시청이 안되요.",개인,TV,장애/고장,,,
LG U+ 인터넷과 휴대폰을 이용하고 있는데요. 청구서를 한장으로 통합하여 받을 수 있나요?,개인,요금 및 납부,요금조회,,,
서비스 신청은 어떻게 하나요?,개인,모바일,부가서비스,데이터,데이터 안심옵션,
휴대폰 소액결제 이용이 안 됩니다.,개인,모바일,부가서비스,생활편의,휴대폰소액결제,
ez포인트(이지포인트)가 뭔가요?,개인,혜택,멤버십 혜택,멤버십카드 / 앱,,
소액결제 차단 및 해제는 어떻게 하나요?,개인,모바일,부가서비스,생활편의,휴대폰소액결제,
U+ 인터넷전화 서비스에 가입하려면 어떻게 해야 하나요?,개인,가입 및 변경,인터넷전화,,,
요금제 변경 시 지원금 반환금은 발생하나요?,개인,혜택,신청/변경불가,O클럽,,
나만의 콕 멤버십은 어떤 서비스인가요?,개인,혜택,멤버십 혜택,멤버십제휴사,,
"요금제에 해당되는 데이터를 모두 소진했을 경우, 추가로 서비스 이용이 가능한가요?",개인,모바일,부가서비스,신규/변경불가 부가서비스,U+ LTE블랙박스,
서비스 해지는 어떻게 하나요?,개인,모바일,부가서비스,생활편의,간편결제매니저,
문자차단 시 상대방에게 알려주기 싫을때는 어떻게 해야 하나요?,개인,모바일,부가서비스,통화/메시지,지정번호필터링,
리모컨의 전원 버튼만 작동되지 않습니다.,개인,TV,장애/고장,,,
U+TV 를 3년 약정으로 가입할 경우 초고속 인터넷 요금은 어떻게 되나요?,개인,혜택,기타 할인 혜택,,,
서비스 사용시 유의해야 할 점이 있나요?,개인,모바일,부가서비스,통화/메시지,발신자미표시번호차단,
미납 문자메시지를 받았어요. 어떻게 해야 하나요?,개인,요금 및 납부,요금납부,,,
U+모바일(휴대폰) 미납 정지시 기본요금이 모두 부과되나요?,개인,가입 및 변경,모바일,,,
U+Box서비스는 무엇인가요?,개인,모바일,부가서비스,생활편의,U+ Box,
070국번으로 수신이 되는 문자를 차단할 수 있나요?,개인,모바일,부가서비스,통화/메시지,스팸차단,
요금제를 변경하면 멤버십 등급도 변경되나요?,개인,혜택,멤버십 혜택,멤버십제휴사,,
현재 사용하고 있는 단말기가 개통한지 24개월이 지난 단말기 입니다. 자동으로 선택약정할인에 가입되는 것인가요?,개인,혜택,휴대폰 살때 할인,단통법,,
단말기 할부금이 뭔가요?,개인,전화,인터넷전화,요금안내,,
셋톱박스의 전원이 들어오지 않습니다.,개인,TV,장애/고장,,,
데이터 통화료는 부과되나요?,개인,모바일,부가서비스,통화/메시지,자녀폰지킴이,
단말기 할부금을 확인할 수 있나요?,개인,요금 및 납부,요금조회,,,
식스플랜이 뭔가요?,개인,U+Shop,모바일,요금할인/혜택,,
지로로 요금 납부 하고 싶은데 어떻게 해야되나요?,개인,인터넷,요금안내,,,
통화상세내역 열람은 어떻게 해야 하나요?,개인,요금 및 납부,요금조회,,,
AI리모컨에 등록한 가전제품이 실행되지 않아요. 어떻게 해야 하나요?,개인,U+스마트홈,스마트홈 기기,AI리모컨,,
인터넷전화 상품은 어떤 요금제가 있나요?,개인,전화,인터넷전화,요금안내,,
약정할인 프로그램은 최대 몇개월까지 제공되나요?,개인,혜택,요금할인,,,
U+광랜을 저희 아파트에서도 이용 가능한가요?,개인,인터넷,상품안내,,,
아이폰은 벨소리 구매를 어디서 해야 되나요?,개인,모바일,부가서비스,뮤직,벨소리,
"링을 충전했는데, 이번 달에 다 사용을 못하면 어떻게 되나요?",개인,모바일,요금제,청소년요금제,,
납부방법을 변경하면 언제부터 적용되나요?,개인,요금 및 납부,요금납부,,,
"데이터가 부족한데, 이번달만 추가로 이용할 수 있는 방법이 있나요?",개인,모바일,요금제,데이터혜택,,
청구서 받는 방법과 주소를 변경하고 싶어요.,개인,요금 및 납부,요금조회,,,
LTE 통합요금제에 대해서 알려주세요.,개인,모바일,요금제,기타,,
가족이면 무조건 가족 무한사랑 클럽에 가입할 수 있는 것인가요?,개인,혜택,신청/변경불가,(구) 가족 무한사랑 클럽,,
U+zone을 이용하고 싶은데 아이디와 비밀번호를 모르겠어요,개인,인터넷,U+zone,이용안내,,
AP를 공유해서 우리집 AP를 남들이 사용하면 내가 손해 아닌가요?,개인,인터넷,U+zone,상품안내,,
U+부모안심플러스 서비스 해지는 어떻게 하나요?,개인,인터넷,부가서비스,부모안심플러스,,
지니뮤직 마음껏 듣기_멤버십 상품을 해지하고 싶습니다.,개인,모바일,부가서비스,뮤직,지니뮤직 마음껏 듣기_멤버십,
홈페이지 또는 고객센터 앱으로 군입대 일시정지를 신청할 수 있나요?,개인,가입 및 변경,군입대 일시정지,,,
맘카를 와이파이에 자동으로 연결할 수 있나요?,개인,U+스마트홈,스마트홈 기기,맘카,,
아이디와 비밀번호가 정확한데 로그인이 되지 않습니다.,개인,서비스안내,홈페이지이용관련,,,
U+모바일(휴대폰) 미납으로 발신 정지가 되었습니다. 수신은 언제까지 가능한가요?,개인,가입 및 변경,모바일,,,
"홈 IoT를 이용하고 있는데요. 이사를 하거나, 집안에서 단말 위치를 변경할 경우, 부착된 홈 IoT 단말은 어떻게 하나요?",개인,가입 및 변경,설치장소 변경,,,
납기일은 어떻게 되나요?,개인,요금 및 납부,요금납부,,,
월 중 가입/해지 시 일할 계산되나요?,개인,혜택,요금할인,장기할인,,
꼭 받아야하는 문자메시지가 스팸 처리됩니다. 어떻게 해야 하나요?,개인,모바일,부가서비스,통화/메시지,스팸차단,
구글셋톱박스로 바꾸고 싶은데 어떻게 해야 하나요?,개인,TV,장비안내,셋톱박스,,
한 대의 맘카 영상을 여러 사람이 동시에 확인할 수 있나요?,개인,U+스마트홈,스마트홈 기기,맘카,,
"전화 수신 시 화면에 나타나는 ""발신번호표시제한"" 과 ""발신번호확인불가"" 는 어떤 차이가 있나요?",개인,모바일,부가서비스,통화/메시지,발신자미표시번호차단,
가족사랑데이터는 어떤 서비스인가요?,개인,모바일,요금제,데이터혜택,,
통화연결음 서비스 변경은 어떻게 하나요?,개인,모바일,부가서비스,뮤직,뮤직벨링 앱,
"플라스틱 멤버십 카드를 오늘 신청했는데, 바로 받을 수 있는 방법은 없나요?",개인,혜택,멤버십 혜택,멤버십카드 / 앱,,
입금전용계좌가 무엇인가요?,개인,요금 및 납부,요금납부,,,
선택약정할인의 할인반환금이 발생되는 경우는 어떤 경우인가요?,개인,혜택,요금할인,선택약정할인,,
사용자 인증번호와 구매 비밀번호를 모르겠어요.,개인,TV,장애/고장,,,
오늘까지 사용한 금액(실시간 요금)을 확인할 수 있나요?,개인,요금 및 납부,요금조회,,,
데이터쉐어링 요금제는 누가 이용할 수 있나요?,개인,모바일,부가서비스,신규/변경불가 부가서비스,U+ LTE블랙박스,
멤버십 카드 가맹점을 알고 싶어요.,개인,혜택,멤버십 혜택,멤버십카드 / 앱,,
와이파이 장비의 펌웨어 업데이트는 어떻게 하나요?,개인,인터넷,장비안내,와이파이,,
회원 탈퇴는 어떻게 하나요?,개인,서비스안내,U+ ID,,,
U+ 인터넷/IPTV/인터넷전화 미납으로 서비스가 중지되었습니다. 요금은 어떻게 청구되나요?,개인,요금 및 납부,요금조회,,,
데이터로밍은 어떻게 설정하나요?,개인,해외로밍,WCDMA/GSM,,,
"문자를 많이 보내는 경우, 자동 차단 될 수 있나요?",개인,전화,인터넷전화,장애/고장,,
"휴대폰에 데이터 안심옵션 부가서비스 등록 시, 쉐어링 전용 단말기에서도 적용이 되나요?",개인,모바일,부가서비스,데이터,데이터 안심옵션,
아이폰도 휴대폰 분실/파손 보상(구.폰케어플러스)에 가입이 가능한가요?,개인,모바일,단말기(휴대폰),아이폰,,
홈페이지 아이디와 비밀번호를 잊어버렸어요.,개인,서비스안내,U+ ID,,,
청구지 주소 및 수취인을 변경하고 싶은데 어떻게 해야 하나요?,개인,가입 및 변경,모바일,,,
"데이터쉐어링 결합 해제 시, 쉐어링 전용 단말기 또한 자동으로 해지되나요?",개인,모바일,부가서비스,데이터,데이터 안심옵션,
"신용카드로 자동이체가 되어 있는데, 요금이 왜 결제되지 않나요?",개인,요금 및 납부,요금납부,,,
널 지켜줄게 서비스는 무엇인가요?,개인,모바일,부가서비스,안심/안전,널 지켜줄게,
결합할 수 있는 가족의 범위는 어떻게 되나요?,개인,혜택,신청/변경불가,(구) 가족 무한사랑 클럽,,
개인 인터넷 해지시 가입자가 아닌 대리인도 해지 신청 가능한가요?,개인,가입 및 변경,인터넷,,,
정전 후 인터넷이 되지 않습니다.,개인,인터넷,장애/고장,,,
"번호이동을 하고 싶은데, 어디에서 신청을 해야 하나요?",개인,가입 및 변경,모바일,,,
"요금을 신용카드로 결제했는데, 연말정산(소득공제) 대상에 포함이 되나요?",개인,요금 및 납부,요금납부,,,
1년 약정 하였는데 3년으로 약정을 변경하고 싶어요. 가능한가요?,개인,가입 및 변경,인터넷,,,
임대폰은 어떻게 이용하나요?,개인,모바일,단말기(휴대폰),휴대폰분실파손,,
타사 보다 느린 것 같아요.,개인,인터넷,속도/품질,,,
데이터 소모량은 얼마나 되나요?,개인,모바일,부가서비스,신규/변경불가 부가서비스,U+ LTE블랙박스,
휴대폰 분실/파손 보험의 상품 종류에 대해 알고싶어요.,개인,모바일,부가서비스,안심/안전,휴대폰 분실/파손 보험,
매너콜 서비스와 다른 점은 무엇인가요?,개인,모바일,부가서비스,통화/메시지,통화가능안내,
LG U+인터넷 등 서비스 이용료를 연말에 소득공제 받을 수 있나요?,개인,인터넷,요금안내,,,
고객센터 앱으로 요금을 납부할 수 있나요?,개인,서비스안내,고객센터 앱,,,
해외에서 자동로밍을 이용하려면 어떻게 해야 합니까?,개인,해외로밍,CDMA자동로밍,,,
부모안심플러스 사용 시 모든 유해물이 차단 되나요?,개인,인터넷,부가서비스,부모안심플러스,,
멤버십 카드를 재발급받는 방법을 알려주세요.,개인,혜택,멤버십 혜택,멤버십카드 / 앱,,
간편결제매니저는 어떻게 사용 하나요?,개인,모바일,부가서비스,생활편의,간편결제매니저,
"TV가 거실과 안방에 각각 있는데, U+ TV 2대 사용이 가능한가요?",개인,가입 및 변경,TV,,,
일시정지를 하게 되면 그 기간도 약정 기간의 일수에 포함되나요?,개인,가입 및 변경,인터넷,,,
착신전환 부가서비스 신청을 하였으나 이용이 되지 않습니다.,개인,전화,인터넷전화,장애/고장,,
휴대폰 번호변경 횟수 제한이 있나요?,개인,서비스안내,홈페이지이용관련,,,
청소년 요금제를 월 중에 가입하면 몇 링을 사용할 수 있나요?,개인,모바일,요금제,청소년요금제,,
음성사서함 비밀번호를 잊어버렸어요.,개인,서비스안내,통화품질,,,
감지기능은 어떤 상황에서 작동하나요?,개인,U+스마트홈,스마트홈 기기,맘카,,
VoLTE서비스 가입자인데 듀얼넘버 이용이 되질 않습니다. 왜 그런가요?,개인,모바일,부가서비스,통화/메시지,듀얼넘버,
인터넷 상품별 기본료는 다른가요?,개인,인터넷,요금안내,,,
휴대폰 소액결제 이용한도 확인 및 변경은 어떻게 하나요?,개인,모바일,부가서비스,생활편의,휴대폰소액결제,
해외 로밍 시 스마트폰을 이용하면 데이터를 사용하지 않아도 데이터 로밍 요금이 부과되나요?,개인,해외로밍,WCDMA/GSM,,,
휴대폰 소액결제 최대 가능한도는 얼마인가요?,개인,모바일,부가서비스,생활편의,휴대폰소액결제,
U+ 휴대폰 정지는 대리인도 신청할 수 있나요?,개인,가입 및 변경,모바일,,,
"같은 사람이 계속 전화를 하면, 매번 문자메시지가 오나요?",개인,모바일,부가서비스,통화/메시지,매너콜,
갑자기 TV소리가 안 나오는데 어떻게 해야 하나요?,개인,TV,장애/고장,,,
받은 데이터 사용량은 어디에서 확인할 수 있나요?,개인,모바일,요금제,데이터혜택,,
U+부모안심플러스는 어떤 서비스인가요?,개인,인터넷,부가서비스,부모안심플러스,,
청구서를 받지 못했습니다. 다시 받고싶은데 어떻게 해야하나요?,개인,요금 및 납부,요금조회,,,
U+모바일 할인번호 대상 변경은 어떻게 하나요?,개인,가입 및 변경,모바일,,,
모뎀 장비에 전원이 들어 오지 않습니다.,개인,인터넷,장애/고장,,,
25 % 요금할인을 받을 수 있다는데 어떤 할인인가요?,개인,혜택,요금할인,선택약정할인,,
"지원금을 받고 단말을 구입하였으나, 중도에 선택약정할인으로 변경하고 싶은데, 가능한가요?",개인,혜택,휴대폰 살때 할인,단통법,,
"투넘버(넘버플러스, 듀얼넘버) 사용자도 서비스가입이 가능 한가요?",개인,모바일,부가서비스,안심/안전,로그인플러스,
매너콜 서비스가 뭐죠?,개인,모바일,부가서비스,통화/메시지,매너콜,
"부모안심플러스를 해지했는데도, 유해사이트 차단창이 나타납니다. 어떻게 하나요?",개인,인터넷,부가서비스,부모안심플러스,,
PC/노트북에서 와이파이 접속방법을 알려주세요,개인,인터넷,장비안내,와이파이,,
